id,publication_id,edition_id,title,other_title,author_creator,corporate_creators,contributors,description_abstract,date_period,year,type,place_of_publishing,publisher,format,extent,other_physical_description,volume,number,isbn,call_number,language,general_note,subject_keywords,url_original_object
379457,410543,379457,Արցախի Հանրապետության Քաշաթաղի շրջանի ամրոցները,Крепости Кашатагского района Республики Арцах ; The fortresses of Qashatagh region of the Artsakh Republic,Սարգսյան Գ․ ; Գնունի․ Ա․ ; Մկրտչյան Լ․,ՀՀ ԳԱԱ Հնագիտութեան և ազգագրության ինստիտուտ,Գիտ․ խմբ․՝ Հայկ Ավետիսյան ; Գոռ Հարությունյան,Երևան,2022,2022,Գիրք,Երևան,«Նռանէ» հրատ․,pdf,233 էջ,"նկ․, աղյս․, քարտեզ․ ; 30 սմ",,,978-9939-9272-4-4,AIII/9423,hy,Գիրքը նվիրվում է Արցախյան բոլոր պատերազմների հերոսներին,Քարտեզագրություն Քաշաթաղ (Արցախի Հանրապետություն) Հնագիտություն Պատմա-ճարտարագիտական հուշարձաններ Ամրոցներ,https://arar.sci.am/dlibra/publication/410543/edition/379457
361603,390925,361603,Արցախի Տիգրանակերտի անտիկ շրջանի դրոշմազարդ խեցեղենը,Античная штампованная керамика Арцахского Тигранакерта ; Stamped pottery of the classical period from Tigranakert in Artsakh,"Գաբրիելյան, Արմինե",ՀՀ ԳԱԱ Հնագիտության և ազգագրության ինստիտուտ,,"Արցախի Տիգրանակերտի անտիկ ժամանակաշրջանի (մ.թ.ա. 1-ին – մ.թ. 3-րդ դդ.) նյութական և հոգևոր մշակույթի ուսումնասիրության առումով մեծ աղբյուրագիտական նշանակություն ունի վերոհիշյալ ժամանակաշրջանի խեցեղենը, որը մեկուկես տասնամյակ տևած պեղումների ամենաառատ հնագիտական նյութն է: Այն, բացի ձևերի բազմազանությունից, ունի նաև մեկ այլ առանձնահատկություն՝ ներկայանում է շքեղ գունազարդ, սև և մոխրագույն, փայլեցված, դրոշմազարդ և փորագիր զարդերով հարդարված տեսակներով: Այս շարքում, թեև փոքրաթիվ, բայց յուրահատուկ խումբ են կազմում դրոշմազարդման եղանակով հարդարված անոթները, որոնք կարող են լույս սփռել Տիգրանակերտի մշակութային նորամուծությունների, առևտրա-մշակութային կապերի և տարածաշրջանում նրա խաղացած մշակութային դերակատարման վրա: The stamped pottery is of a great significance for the research of the material and spiritual culture of the Classical period (I century BC - III century AD) of Tigranakert of Artsakh (the former Nagorno-Karabakh Autonomous region). The ceramic assemblage includes vessels of different forms and styles, as well as elaborately decorated, black and grey polished, stamped and incised examples. The examples, decorated with stamped ornamentation make a small, but diverse group in this collection. Distinctive examples of the stamped pottery discovered during the excavations of Tigranakert at different field seasons are black, polished goblets, phialas and fragments of bowls, decorated with stamped images of grape clusters. The elegant execution of the design of the polished black cluster-bearing vessels, with a dense black slip and surface polishing leave an impression of lacquering. All these characteristics allow suggesting that they were used for a particular purpose. The next group of the stamped pottery of Tigranakert is presented by potsherds with surface color that varies from light reddish-pink to ochre. They bear stamped decorations of a tree or a leaf in different positions. Pottery with different stamped decorations had been widespread in the Armenian highlands since the Urartian period. Only a few examples of stamped pottery are known from sites of the Classical period in Armenia (Artashat, Avan, Yervandashat). In this context, the stamped pottery of Tigranakert is of a great importance. It reveals essential evidence regarding the trade and cultural connections, cultural innovations, and the cultural role Tigranakert played in the region in the Classical period. Для изучения материальной и духовной культуры Арцахского Тигранакерта античного периода (I в. до н.э. - III в. н.э.) большое источниковедческое значение имеет посуда. Керамический ассортимент включает не только сосуды различных форм, но и богато орнаментированные, черные и серые лощеные, штампованные образцы и также сосуды с резной орнаментацией. В этом штампованным методом. Исключительными примерами штампованной керамики являются выявленные благодаря раскопкам Тигранакерта в различные годы черные, лощеные до зеркального блеска кубки, чаши-пиалы и фрагменты мисок, с внутренней стороны украшенные штампованными изображениями гроздей винограда. Изящное исполнение всей композиции чернолощеных сосудов, украшенных изображениями гроздей винограда, черная густая обмазка, лощение, которое оставляет впечатление черной лакировки, придают этим сосудам особую красоту и позволяют предположить, что они использовались в особых целях. Следующую группу сосудов Тигранакерта со штампованным орнаментом составляют фрагменты с оттенками от светло-красно-розового до охристого. На них представлены изображения дерева или листьев, имеющих различное расположение.",2023,2023,Հոդված,,ՀՀ ԳԱԱ Հնագիտության և ազգագրության ինստիտուտ,pdf,,,5,,,,,,Հուշարձաններ Գտածոներ կենաց ծառ Արցախի Տիգրանակերտ անտիկ շրջան դրոշմազարդ խեցեղեն ողկույզ գինեգործություն,https://arar.sci.am/dlibra/publication/390925/edition/361603
390258,423045,390258,Արքետիպային հարակցումները հայկական հրաաշապատում հեքիաթներում և վիպապատմական բանահյուսության մեջ,Сочетание архетипов в армянских волшебных сказках и в эпическом наследии ; Combination of archetypes in Armenian tales of magic and epic heritage,"Հայրապետյան, Թամար",ՀՀ ԳԱԱ Հնագիտության և ազգագրության ինստիտուտ,Պատ․ խմբ․՝ Սարգիս Հարությունյան,Երևան,2016,2016,Գիրք,Երևան,ՀՀ ԳԱԱ «Գիտություն» հրատ.,pdf,462 էջ,21 սմ ; նկ․,,,978-5-8080-1245-5,AII/102848 ; AII/102280 ; AII/102281,hy,,Հայկական հեքիաթներ Քննադատություն և վերլուծություն,https://arar.sci.am/dlibra/publication/423045/edition/390258
375803,406545,375803,Բանագիտական ակնարկներ,Фольклористические очерки ; Essays on folklore studies,"Հարությունյան, Սարգիս",ՀՀ ԳԱԱ Հնագիտության և ազգագրության ինստիտուտ,,Երևան,2010,2010,Գիրք,Երևան,ՀՀ ԳԱԱ «Գիտություն» հրատ.,pdf,262 էջ,,,,978-5-8080-0847-2,AII/96390 ; AII/96391 ; AII/97611,hy,,Բանագիտություն Ակնարկներ,https://arar.sci.am/dlibra/publication/406545/edition/375803
215401,235857,215401,Բանահյուսական և ազգագրական նյութերի կենցաղավարումը Արարատի մարզի Վեդու տարածաշրջանում,Бытование фольклорных и этнографических материалов в Ведийском районе; Folklore and Ethnographic Materials in the Vedi Region,"Վարդանյան, Սվետլանա ; Մարգարյան, Հասմիկ",ՀՀ ԳԱԱ Հնագիտության և ազգագրության ինստիտուտ,,"Հոդվածը նվիրված է Արարատի մարզի Վեդու տարածաշրջանում կատարված գործուղումերի արդյունքների վերհանմանը: Մեր նպատակներից առաջնայինը տեղավայրի էթնիկ կազմի, հոգևոր մշակութային արժեքների վերաբերյալ աղբյուրագիտական կարևորություն ներկայացնող նյութերի ձեռքբերումն ու բացահայտումն էր: Статья посвящена результатам фольклорных и этнографических исследований, проведенных в Ведийском районе. Первостепенной задачей наших исследований было выявление этнического состава, духовно-культурных ценностей данного региона. The aim of the article is to present the results of the scientific mission carried out in the Ararat region. One of the primary goals of our mission was to discover and document the important material sources related to the ethnic composition and the spiritual culture values of the region.",2018,2018,Հոդված,,ՀՀ ԳԱԱ Հնագիտության և ազգագրության ինստիտուտ,pdf,,,2,,978-9939-9178-2-5,,,,Literature Էթնիկ կազմ մշակույթ Արարատի մարզ,https://arar.sci.am/dlibra/publication/235857/edition/215401
375687,406484,375687,Բանահյուսություն,Folklore,"Հովսեփյան, Հովհաննես",ՀՀ ԳԱԱ Հնագիտութեան և ազգագրութեան ինստիտուտ,Պատ․ խմբ․՝ Ալվարդ Սարուխանի Ղազիյան,Երևան,2009,2009,Գիրք,Երևան,ՀՀ ԳԱԱ «Գիտություն» հրատ.,pdf,643 էջ,"նկ., քարտե ; լուսանկ.",2,,978-5-8080-0700-0,AII/95406,hy,,Ազգագրություն,https://arar.sci.am/dlibra/publication/406484/edition/375687
255860,264858,255860,Բանտի մշակութային մարդաբանությունն՝ ըստ Փարաջանովի ստեղծագործությունների,Ethnography of Prison Based on Parajanov’s Works; Тюремная этнография согласно произведениям Параджанова,"Միքայելյան, Անահիտ",ՀՀ ԳԱԱ Հնագիտության և ազգագրության ինստիտուտ,,"Նշանավոր արվեստագետ Սերգեյ Փարաջանովի կոլաժների, գծանկարների և ֆիլմի սցենարի նկարագրության միջոցով փորձ է կատարվում վերլուծելու բանտի մշակութային մարդաբանության արտացոլումը արվեստի գործերում: The article presents the social anthropology of the Soviet prison in the 1970s based on the collages, graphic works and a film script created in prison by the famous film director and artist S. Parajanov. Parajanov was not a researcher while reflecting the prison cultural anthropology in his artworks․ В статье на основе творчества (коллажей, графических работ и сценариев) известного кинорежисера и художника С. Параджанова представлена социальная антропология советской тюрьмы 1970-ых годов. Тюремная жизнь, её законы, образ зека, карточные игры и порнография послужили материалом для творчества С. Параджанова.",2019,2019,Հոդված,,ՀՀ ԳԱԱ Հնագիտության և ազգագրության ինստիտուտ,pdf,,,3,,978-9939-9178-9-4,,,,"Arts խորհրդային բանտ բանտային ազգագրություն բանտարկյալների առօրյա,բանտային սովորույթներ թանգարանային ցուցադրություն",https://arar.sci.am/dlibra/publication/264858/edition/255860
376687,407595,376687,Բառարան Վանի բարբառի,Словарь Ванского диалекта ; Dictionary of Van dialect,"Թուրշյան, Հարություն",ՀՀ ԳԱԱ Հնագիտությնա և ազգագարության ինստիտուտ ; ՀՀ ԳԱԱ Հ․ Աճառյանի անվան լեզվի ինստիտուտ ; «Վասպուրական» հայրենակցական միություն,Աշխատ.՝ Հայկանուշ Մեսրոպյան,Երևան,2018,2018,Գիրք,,ՀՀ ԳԱԱ «Գիտություն» հրատ.,pdf,272 էջ,24 սմ ; դիմանկ.,,,978-5-8080-1311-7,AII/103420 ; AII/103421,hy,,Լեզվաբանություն Բառարաններ Բարբառագիտություն,https://arar.sci.am/dlibra/publication/407595/edition/376687
360278,389538,360278,Բացառապես կրծքով կերակրման վեցամսյակը՝ որպես մոր եւ մանկան կյանքի անցումային փուլ,Шестимесячный период исключительно грудного вскармливания как переходный этап в жизни матери и младенца ; The Six Months՚ Period of Exclusive Breastfeeding as a Transitional Phase in the Life of Mother and Infant,"Ստեփանյան, Գոհար",ՀՀ ԳԱԱ Հնագիտության և ազգագրության ինստիտուտ,,"Հոդվածը նվիրված է բացառապես կրծքով կերակրման (այսուհետ՝ ԲԿԿ) վեցամսյակին, որը դիտարկվում է որպես անցումային շրջան մոր և մանկան կյանքում: Հետազոտության աղբյուրը Դիմագիրք (Facebook) սոցցանցում գործող՝ մայրիկների ամենատարբեր խմբերն են: Հատկանշական են հաջողված պատմություն հեշտանիշի (Hashtag) ներքո հավաքվող մայրերի՝ կրծքով կերակրման (այսուհետ՝ ԿԿ) պատմությունները: Սրանք ԿԿ յուրօրինակ պատմաշարեր են, որոնց ձևակերպումն իսկ՝ որպես հաջողված պատմություն, վկայում է ԿԿ ուղու բարդության մասին: Մյուս կողմից, ԿԿ պատմություններում վեցամսյակի առանձնացումը՝ որպես առանձին պատմաշար, խոսում է ԲԿԿ շրջանն իբրև առանձին անցումային փուլ դիտարկելու օգտին: Մայրերի բառամթերքը, որով նրանք ներկայացնում են այս շրջանի հետ կապված իրենց ապրումներն ու փորձառությունը, հուշում է վեցամսյա փուլի և դրա ավարտի ծիսական որոշակի ենթատեքստի մասին: Իր կարևորությամբ և փորձությունների հաղթահարման դժվարությամբ՝ քննարկվող շրջանը ետևում է թողնում վաղ մանկության շրջանի անցումային այլ փուլեր, մասնավորապես՝ քառասունքը և մինչև անգամ հղիության/ ներարգանդային կյանքի ինն ամիսները, իսկ ինչ վերաբերում է ծննդյան ակտին, ապա միանգամայն համադրելի է համարվում վերջինիս հետ: Իրականում, այս երկու՝ ներարգանդային և ԿԿ շրջանները, համադրելի են միմյանց հետ՝ նախ և առաջ իբրև մոր և մանկան միասնության փուլեր, և վեցամսյակում մանկատածության առանցքային խնդիրն է դառնում հենց այդ՝ ներարգանդային միասնության ապահովումն արտարգանդային կյանքում: Исследование посвящено первому шестимесячному периоду исключительно грудного вскармливания, который мы рассматриваем как переходный период в жизни матери и ребенка. Источником исследования являются разные группы матерей, действующие в социальных медиа и, в частности, в фейсбуке, которые мы называем университетами материнства. Примечательно, что матери этих групп представляют грудное вскармливание вообще и исключительно грудное вскармливание, в частности, как путешествие։ символика дороги/путешествия тесно связана с переходными обрядами, которые осмысляются как путешествие в иной мир (смерть и возвращение), возрождение в новом статусе. Интересны также характеристики этого путешествия как «самые важные шесть месяцев», «первый важный этап», «самый трудный путь», конец которого – «важная победа». Встречается и определение «войны », которое по-своему подчеркивает лиминальность/экстремальность шестимесячного периода. The current research is dedicated to the first six months of exclusive breastfeeding, which I consider as a transitional or liminal period in the life of the mother and child. The sources of this research are various mothers’ groups on social media, particularly in Facebook, which I define as universities of motherhood. It is remarkable that mothers in these groups represent breastfeeding in general and exclusive breastfeeding in particular as a journey։ the symbolism of path/journey is closely linked with the rites of passage, for which the journey to the other world (death) and returning (re-birth) with a new status is a crucial aspect. Mothers’ characterizations of this journey are also interesting, e.g. “the most responsible six months,” “the first most important phase,” “a difficult road” the end of which is “an important victory,” “completing the task with honor”.",2021,2021,Հոդված,,ՀՀ ԳԱԱ Հնագիտության և ազգագրության ինստիտուտ,pdf,,,4,,978-9939-886-13-8,,,,Դաշտային հետազոտություններ բացառապես կրծքով կերակրում կաթնախառնուրդ անցումային փուլ երեխայակենտրոն մանկատածություն կրծքով կերակրման պատմաշարեր,https://arar.sci.am/dlibra/publication/389538/edition/360278
376212,407102,376212,Բաքվի հայոց բանահյուսությունը,,,ՀՀ ԳԱԱ Հնագիտութեան և ազգագրության ինստիտուտ,"Պատ․ խմբ.՝ Սարգիս Հարությունյան ; Կազմ., ներած․ և ծանոթագր.՝ Ալվարդ Սարուխանի Ղազիյան ; Սվետլանա Ավետիսի Վարդանյան",Երևան,2004,2004,Գիրք,Երևան,Զանգակ-97,pdf,380 էջ,աղյս. ; 20 սմ,,,99930-2-600-x,AII/89774 ; AII/91245,hy,,Հայ բանահյուսություն Հայաստան,https://arar.sci.am/dlibra/publication/407102/edition/376212
376210,407100,376210,Բիայնիլի-Ուրարտու,Biainili-Urartu,"Գրեկյան, Երվանդ ; Բադալյան, Միքայել ; Տիրացյան, Նվարդ ; Պետրոսյան, Արմեն",ՀՀ ԳԱԱ Հնագիտության և ազգագրության ինստիտուտ,Խմբ.՝ Արմեն Պետրոսյան,Երևան,2018,2018,Գիրք,Երևան,ՀԱԻ հրատ.,pdf,204 էջ,նկ․ ; 20 սմ,,,978-9939-9178-0-1,AII/103824 ; AII/103823 ; AII/104750 ; AII/104751,hy,,Ուրարտու Հայ հնագույն պատմություն Պաշտամունք,https://arar.sci.am/dlibra/publication/407100/edition/376210
379841,411038,379841,Բնագրեր,Тексты,"Գրիգորյան, Գր․ Ա․",ՀՍՍՀ ԳԱ Հնագիտիտության և ազգագրության ինստիտուտ,Պատ․ խմբ․՝ Ա․ Մ․ Նազինյան,Երևան,1986,1986,Գիրք,Երևան,ՀՍՍՀ ԳԱ հրատ.,pdf,417 էջ,22 սմ,Գիրք հինգերորդ,,,AII/73437 ; AII/74757 ; AII/74758 ; AII/74759,hy,,Բանահյուսություն,https://arar.sci.am/dlibra/publication/411038/edition/379841
379468,410580,379468,Բովանդակություն,Necropolis of Lchashen I ; Лчашенский некрoполь I,"Պետրոսյան, Լևոն Աղասու",ՀՀ ԳԱԱ Հնագիտւթյան և ազգագրության ինստիտուտ,,Երևան,2018,2018,Հոդված,Երևան,ՀԱԻ հրատ.,pdf,,,22,,978-9939-9178-1-8,,hy,22 (Հայաստանի հնագիտական հուշարձանները),Հնագիտություն Դամբարաններ Հուշարձաններ,https://arar.sci.am/dlibra/publication/410580/edition/379468
215337,235794,215337,Բովանդակություն,,,ՀՀ ԳԱԱ Հնագիտության և ազգագրության ինստիտուտ,,"Nasza Biblioteka Cyfrowa is... Here put the description for the main page matadata, visible e.g. when sharing on Facebook.",2018,2018,Հոդված,,ՀՀ ԳԱԱ Հնագիտության և ազգագրության ինստիտուտ,pdf,,,2,,978-9939-9178-2-5,,,,Ազգագրություն Հնագիտություն,https://arar.sci.am/dlibra/publication/235794/edition/215337
215313,235769,215313,Բովանդակություն; Contents,,,ՀՀ ԳԱԱ Հնագիտության և ազգագրության ինստիտուտ,,"Nasza Biblioteka Cyfrowa is... Here put the description for the main page matadata, visible e.g. when sharing on Facebook.",2017,2017,Հոդված,,ՀՀ ԳԱԱ Հնագիտության և ազգագրության ինստիտուտ,pdf,,,1,,978-5-8080-1293-6,,,,Ազգագրություն Հնագիտություն,https://arar.sci.am/dlibra/publication/235769/edition/215313
238691,260643,238691,Բովանդակություն; Contents; Содержание,,,ՀՀ ԳԱԱ Հնագիտության և ազգագրության ինստիտուտ,,"Nasza Biblioteka Cyfrowa is... Here put the description for the main page matadata, visible e.g. when sharing on Facebook.",2019,2019,Հոդված,,ՀՀ ԳԱԱ Հնագիտության և ազգագրության ինստիտուտ,pdf,,,3,,978-9939-9178-9-4,,,,Ազգագրություն Հնագիտություն,https://arar.sci.am/dlibra/publication/260643/edition/238691
360249,389492,360249,Բովանդակություն; Contents; Содержание,,,ՀՀ ԳԱԱ Հնագիտության և ազգագրության ինստիտուտ,,"Nasza Biblioteka Cyfrowa is... Here put the description for the main page matadata, visible e.g. when sharing on Facebook.",2021,2021,Հոդված,,ՀՀ ԳԱԱ Հնագիտության և ազգագրության ինստիտուտ,pdf,,,4,,978-9939-886-13-8,,,,Ազգագրություն Հնագիտություն,https://arar.sci.am/dlibra/publication/389492/edition/360249
361597,390918,361597,Բովանդակություն; Содержание; Contents,,,ՀՀ ԳԱԱ Հնագիտության և ազգագրության ինստիտուտ,,"Nasza Biblioteka Cyfrowa is... Here put the description for the main page matadata, visible e.g. when sharing on Facebook.",2023,2023,Հոդված,,ՀՀ ԳԱԱ Հնագիտության և ազգագրության ինստիտուտ,pdf,,,5,,,,,,Ազգագրություն Հնագիտություն,https://arar.sci.am/dlibra/publication/390918/edition/361597
379382,410458,379382,Բովանդակություն; Содержание; Contents,,,ՀՀ ԳԱԱ Հնագիտության և ազգագրության ինստիտուտ,,"Nasza Biblioteka Cyfrowa is... Here put the description for the main page matadata, visible e.g. when sharing on Facebook.",2024,2024,Հոդված,,ՀՀ ԳԱԱ Հնագիտության և ազգագրության ինստիտուտ,pdf,,,6,,,,,,Ազգագրություն Հնագիտություն,https://arar.sci.am/dlibra/publication/410458/edition/379382
