id,publication_id,edition_id,title,other_title,author_creator,corporate_creators,contributors,description_abstract,date_period,year,type,place_of_publishing,publisher,format,extent,other_physical_description,volume,number,isbn,call_number,language,general_note,subject_keywords,url_original_object
379393,410484,379393,Հագուստը որպես խորհրդահայ եւ ետխորհրդահայ հասարակության սոցիալ-հոգեբանական ցուցիչ,Одежда как социально-психологический показатель советско- и пост-советско-армянского общества ; Clothing as a socio-psychological indicator of soviet- and post-soviet armenian society,"Պողոսյան, Սվետլանա",ՀՀ ԳԱԱ Հնագիտության և ազգագրության ինստիտուտ,,"Հոդվածի թեման արդիական է և նորութային: Ազգաբանական տեսանկյունից ուսումնասիրելով և համադրելով հագուստն ավանդական տարազին՝ բացահայտվում են սեռային՝ կնոջ և տղամարդու, սոցիալական, հոգեբանական, գեղագիտական և էրոտիկ, սեզոնային և պրեստիժային, առօրյա և տոնածիսական գործառույթների և դրանց տարածման աստիճանի առանձնահատկություններ։ Դրանց հետազոտումը կարևոր է ավանդական մշակույթի, տվյալ դեպքում՝ տարազի համակարգի փոփոխությունները, ինչպես նաև խորհրդային և ետխորհրդային հագուստի զարգացման միտումները տարբեր սոցիալական խմբերում և ենթախմբերում դիտարկելու առումով՝ տեղական և փոխառված ու համահարթեցված տարբերակներով հանդերձ։ Important aspects of the ethnological study of clothing are gender, social, psychological and aesthetic layers. The study is important in terms of considering trends in the development of traditional culture, as well as Soviet and post-Soviet clothing in various social strata. Clothing, being an important part of everyday culture, demonstrates special features in the multi-layered Soviet society. In addition to practical significance, clothing demonstrates mental, emotional, aesthetic preferences, tastes, as well as perceptions and representations of the real or preferred status, desires and aspirations of the wearer. Важным аспектом этнологического изучения одежды являются гендерный, социальный, психологический и эстетический слои. Их изучение важно для наблюдения за тенденциями развития традиционной культуры, а также одежды в различных социальных слоях советского и постсоветского периодов. Одежда, как важная часть повседневной культуры, представляет особые черты в многослойной советской среде. Помимо практического значения, она демонстрирует психические, эмоциональные, эстетические предпочтения, вкусы, а также восприятия и представления реального или желаемого статуса, желания и стремления носителя. Очень важны проявления предпочтений людей, особенно женщин, в отношении отечественных и импортных образцов одежды в советской среде. Не менее важны проявления общественных предпочтений коллективистского характера, и проявления влияния всеобщего мнения и диктата во внешнем облике и одежде различных слоев общества. В первые десятилетия советской власти пропагандировалась официальная эстетика, выражение специфических черт образа советского человека в манере поведения, внешнем облике, а также в одежде: скромность, практичность, комфорт, однообразие и универсальность в государственной недифференцированной одежде.",2024,2024,Հոդված,,ՀՀ ԳԱԱ Հնագիտության և ազգագրության ինստիտուտ,pdf,,,6,,,,,,Ավանդույթներ սեռային գեղագիտական խորհրդային ետխորհրդային նախընտրություններ հագուստ,https://arar.sci.am/dlibra/publication/410484/edition/379393
379387,410465,379387,«Հալեպի շուկան»՝ որպես սիրիահայերի ձեռնարկատիրական գործունեության միկրոմոդել,“Рынок Алеппо” как микромодель предпринимательской деятельности сирийских армян ; “Aleppo market” as a micro-model of the entrepreneurial activityof syrian-armenians,"Հակոբյան, Գայանե",ՀՀ ԳԱԱ Հնագիտության և ազգագրության ինստիտուտ,,"In 2011, as a consequence of the civil war in Syria, a part of the Syrian Armenian population immigrated to Armenia. They used to live in a different system of socio- economic relations, and after moving to a completely new environment, they had to adapt in order to begin activities in Armenia and continue their lives. In this article we have discussed the business activities of Syrian Armenians in Yerevan, ten years after they moved, considering the activities unfolding in the “Aleppo market” as an example. “Aleppo market” was created in 2014–2015. 2011 թ. Սիրիայում ընթացող պատերազմի պատճառով սիրիահայ համայնքի մի ստվար զանգված տեղափոխվեց Հայաստան. ըստ 2017 թ. պաշտոնական տեղեկատվության՝ պատերազմի բռնկվելուց ի վեր՝ մոտ 22000 մարդ: Փորձագետների գնահատականների համաձայն՝ ներկայումս Հայաստանում բնակվում է մինչև 8000 սիրիահայ: Նրանց՝ Հայաստանում ինտեգրվելու և հետագա կենսագործունեությունը շարունակելու որոշման վրա շատ գործոններ ազդեցին: Տնտեսական գործոնը ևս շատ կարևոր էր, քանզի զբաղվածության խնդրի լուծումը ինտեգրման գործընթացի շարունակականությունն ապահովող պայմաններից է: В результате войны в Сирии в 2011 году часть сирийских армян иммигрировала в Армению. Раньше они жили в другой системе социально-экономических отношений, и после переезда в совершенно новую среду адаптация стала для них необходимостью, чтобы начать деятельность в Армении и продолжить свою дальнейшую жизнь.",2024,2024,Հոդված,,ՀՀ ԳԱԱ Հնագիտության և ազգագրության ինստիտուտ,pdf,,,6,,,,,,Հայաստանի սոցիալ-մշակութային լանդշաֆտ սիրիահայեր ներգաղթ ադապտացիա ինտեգրում ձեռնարկատիրական գործունեություն «Հալեպի շուկա»,https://arar.sci.am/dlibra/publication/410465/edition/379387
361626,390948,361626,Հակոբ Չոլաքյան - 75,,"Մալոյան, Արման",ՀՀ ԳԱԱ Հնագիտության և ազգագրության ինստիտուտ,,"Nasza Biblioteka Cyfrowa is... Here put the description for the main page matadata, visible e.g. when sharing on Facebook.",2023,2023,Հոդված,,ՀՀ ԳԱԱ Հնագիտության և ազգագրության ինստիտուտ,pdf,,,5,,,,,,Հոբելյանական Կենսագրություն Մանկավարժություն,https://arar.sci.am/dlibra/publication/390948/edition/361626
10354,11706,10354,Համշենահայերի ազգագրությունը,Этнография амшенских армян,"Թոռլաքյան, Բ. Գ.",ՀՍՍՀ ԳԱ հնագիտության և ազգագրության ինստիտուտ,Խմբ.՝ Լ. Ն. Պետրոսյան,Երևան,1982,1982,Գիրք,Երևան,ՀՍՍՀ ԳԱ հրատ․,pdf,155 էջ,,,13,,AIII/5116,hy,,Հայ ազգագրություն Հայ բանահյուսություն,https://arar.sci.am/dlibra/publication/11706/edition/10354
414865,449867,414865,Հայագիտական ամառնային խտացեալ դասընթացքին 40-րդ տարին. Վենետիկի մեջ՝ հայկական աշխարհ,,"Բռնալեան, Սիւզան",ՀՀ ԳԱԱ Հնագիտության և ազգագրության ինստիտուտ,,"Nasza Biblioteka Cyfrowa is... Here put the description for the main page matadata, visible e.g. when sharing on Facebook.",2025,2025,Հոդված,,ՀՀ ԳԱԱ Հնագիտության և ազգագրության ինստիտուտ,pdf,,,7,,2953-805X,,,,Լրատու Կրթութիւն Վենետիկ,https://arar.sci.am/dlibra/publication/449867/edition/414865
380062,411202,380062,Հայագիտական հետազոտություններ,Арменоведческие исследования,"Տեր-Ավետիսյան, Ս․ Վ․",ՀՀ ԳԱԱ Հնագիտության և ազգագրության ինստիտուտ,"Կազմ․, խմբ․՝ Ա․ Ա․ Քալանթարյան",Երևան,2010,2010,Գիրք,Երևան,ՀՀ ԳԱԱ «Գիտություն» հրատ.,pdf,502 էջ,"նկ․, աղյս․, քարտ․ ; 29 սմ",,,978-5-8080-0814-4,AIII/7854 ; AIII/7855 ; AIII/8080 ; AIII/8291 ; AIII/8292 ; AIII/9148,hy ; ru,,Հայոց պատմություն Հնագիտություն Ազգագրություն Հայաստան,https://arar.sci.am/dlibra/publication/411202/edition/380062
379385,410462,379385,Հայաստանը ռուսաստանցի ներգաղթյալների ընկալումներում,Армения в восприятиях российских иммигрантов ; Armenia in the perceptions of russian immigrants,"Ներսիսյան, Սոնա",ՀՀ ԳԱԱ Հնագիտության և ազգագրության ինստիտուտ,,"ՀՀ-ում ներգաղթի ու ներգաղթյալների վերաբերյալ ուսումնասիրությունները մեծ մասամբ շեշտադրում են Հայաստանի` որպես ընդունող պետության դերն ու դրանից բխող հարցերը: Այսպիսի մոտեցումն արտացոլում է խնդրի առանձին կողմերը՝ դարձնելով այն սահմանափակ: Օրինակ՝ ՀՀ-ում ներգաղթյալներին ուղղված թիրախային քաղաքականության կիրարկման հնարավորությունը մշտապես իրացվել է իրադարձային հոսքերի միջոցով, որոնց գերակշիռ մեծամասնությունը հայեր են եղել: 2022-2023 թթ. Ռուսաստանի քաղաքացիների մեծածավալ ներգաղթը Հայաստան շեշտադրեց այլազգի ներգաղթյալների վերաբերյալ ուսումնասիրության անհրաժեշտությունը: Only in 2022 and 2023, more immigrants moved to Armenia from Russia than in the previous 10 years taken together. The national composition of those who moved mainly included Russians, Ukrainians, Belarusians, Armenians, etc., who came to Armenia for various purposes, in many cases transferring their financial resources and capital. Только в 2022 и 2023 годах в Армению из России переехало больше иммигрантов, чем за предыдущие 10 лет вместе взятые. В национальный состав переехавших в основном входили русские, украинцы, белорусы, армяне и т.д., переехавшие в Армению с различными целями, во многих случаях, взяв с собой финансовые средства, имеющийся капитал. Имея общее историческое прошлое, иностранные иммигранты переехавшие из России, видят определенную безопасность в армянской социальной среде. Подавляющее большинство исповедует христианство, а язык понятен для общения с местными жителями. С точки зрения адаптации и интеграции эта группа имеет определенные преимущества. Однако, среди переехавших из России выделяются разные группы, каждая из которых изучалась на отдельном этапе.",2024,2024,Հոդված,,ՀՀ ԳԱԱ Հնագիտության և ազգագրության ինստիտուտ,pdf,,,6,,,,,,Միգրացիոն գործընթացներ ներգաղթյալների ընկալումներ ռուսաստանցի ներգաղթյալներ հարմարում համարկում,https://arar.sci.am/dlibra/publication/410462/edition/379385
379759,410967,379759,Հայաստանի կոլտնտեսականների ընտանիքը և ընտանեկան կենցաղը,Семья и семейный быт колхозников Армении,"Վարդումյան, Դ. ; Կարապետյան, Է.",ՀՍՍՌ ԳԱ Հնագիտության և ազգագրության ինստիտուտ,Պատ․ խմբ․՝ Կ․ Վ․ Մելիք-Փաշայան,Երևան,1963,1963,Գիրք,Երևան,ՀՍՍՌ ԳԱ հրատ.,pdf,126 էջ,"աղս., 20 սմ",,,,AII/29955 ; AII/29956 ; AII/29957 ; AII/29958 ; AII/29959,hy,,Բարոյագիտություն Ընտանիք,https://arar.sci.am/dlibra/publication/410967/edition/379759
379386,410464,379386,Հայաստանի հայրենադարձության քաղաքականության հիմնահարցերն արդի իրողությունների համատեքստում,Основные проблемы политики репатриации Армении в контексте современных реалий ; Main issues of armenia’s repatriation policyin the context of contemporary realities,"Բարսեղյան, Սյուզաննա",ՀՀ ԳԱԱ Հնագիտության և ազգագրության ինստիտուտ,,"Համաշխարհայնացման, աճող միգրացիոն հոսքերի և սփյուռքյան համայնքների ձևավորմանը զուգընթաց հայրենադարձության երևույթն ավելի շատ է հայտնվում հետազոտողների և միգրացիոն ու սփյուռքի քաղաքականություններ մշակողների ուշադրության կենտրոնում։ Հայրենադարձության վերաբերյալ հետազոտությունները հաճախ կենտրոնանում են էքսպատրիատների, միգրանտների, ինչպես նաև փախստականների, աքսորյալների և գերիների վերադարձի գործընթացի տարբեր կողմերի վրա, ներառյալ՝ իրավական, էթիկական, մշակութային, սոցիալական, տնտեսական ևն։ Սփյուռքի ուսումնասիրությունները դիտարկում են վերադարձի միգրացիան երեք հարթություններով՝ որպես գիտական խնդիր, որպես սփյուռքյան առասպելաբանություն և որպես իրականություն՝ վերադարձած միգրանտների համար։ Այդ իրականությունը հաճախ արտացոլվում է քաղաքականություններում, որոնք իրագործվում են ավելի շատ ծագման երկրների կամ հայրենիքների, ավելի քիչ՝ ընդունող երկրների և միջազգային կառույցների կողմից։ Հայրենադարձության քաղաքականությունների վերլուծությունը հնարավորություն է տալիս հասկանալ հայրենադարձության հետ կապված մարտահրավերները, ռազմավարությունները և արդյունքները: Nation-states include or exclude certain groups or individuals into the state through migration policies, legal regulations and citizenship laws, and other means, transforming the boundaries of the nation and national identity. Repatriation has a special place in the regulation of migration flows, which is one of the forms of immigration encouraged and supported by the state. In international law the policy of repatriation is considered as the implementation of one of the fundamental human rights - the “right of return”, to move to a territory of country that he considers his homeland. Currently several dozen countries are implementing repatriation policies or have developed legislative regulations for this process. Посредством миграционной политики, правовых регуляций и законов о гражданстве национальные государства включают или исключают те или иные группы или личности в состав государства, трансформируя границы нации и национальной идентичности. В регуляциях миграционных потоков особое место занимает репатриация, которая является одной из форм иммиграции, поощряемой и поддерживаемой государством. В международном праве политика репатриации рассматривается как реализация одного из основополагающих прав человека – «права на возвращение», перемещение в страну или на территорию, которую он считает своей родиной. В настоящее время несколько десятков стран осуществляют политику репатриации или выработали законодательные регуляции этого процесса. Репатриация особенно важна для развивающихся стран, обладающих диаспорой. Привлечение человеческого, социального и финансового капитала диаспоры также имеет особое значение для развития Армении. Если для других стран основной целью репатриации является обеспечение доминанты титульной нации в этническом и/или конфессиональном составе государства, политическое значение, то для Армении, как моноэтнической страны, основные задачи репатриации можно рассматривать главным образом с точки зрения национальной безопасности и демографического, экономического, социально-культурного развития. Однако, казалось бы, простой процесс возвращения в «место происхождения» или на родину (этническую родину) сам по себе трудно поддается определению и нуждается в политике, правовых основах и программах интеграции.",2024,2024,Հոդված,,ՀՀ ԳԱԱ Հնագիտության և ազգագրության ինստիտուտ,pdf,,,6,,,,,,Միգրացիոն գործընթացներ հայրենադարձություն միգրացիա Սփյուռք հայրենիք քաղաքականություն,https://arar.sci.am/dlibra/publication/410464/edition/379386
380306,411426,380306,Հայաստանի Հանրապետության ազգային փոքրամասնությունները քաղաքացիական հասարակության կայացման արդի պայմաններում,Национальные меньшинства Республики Армения сегодня ; National minorities of the Republic of Armenia in transition,,ՀՀ ԳԱԱ Հնագիտության և ազգագրության ինստիտուտ ; «Ոստան» էթնոմշակութաբանական հետազոտությունների կենտրոն,Խմբ.՝ Յու. Մկրտումյան,Երևան,2005,2005,Գիրք,Երևան,ՀՀ ԳԱԱ «Գիտություն» հրատ.,pdf,254 էջ,20 սմ,Գիրք II,,5-8080-0615-5,AII/91638 ; AII/91639,hy,,Էթնոմշակութաբանություն Ազգային փոքրամասնություններ,https://arar.sci.am/dlibra/publication/411426/edition/380306
376268,407140,376268,Հայաստանի Հանրապետության ազգային փոքրամասնությունների միգրացիան,The migration of national minorities of the Republic of Armenia (Ethno-sociological research) ; Миграция национальных меньшинств Республики Армения (Этносоциологическое исследование),"Գալստյան, Միհրան",ՀՀ ԳԱԱ Հնագիտության և ազգագրության ինստիտուտ,Պատ․ խմբ․՝ Լ․ Մ․ Վարդանյան,Երևան,2015,2015,Գիրք,Երևան,ՀՀ ԳԱԱ «Գիտություն» հրատ.,pdf,208 էջ,աղս.,,,978-5-8080-1155-7,AII/100791 ; AII/100792 ; AII/100809,hy,,Միգրացիոն գործընթացներ Հայաստանի Հանրապետություն Ազգային փոքրամասնություններ,https://arar.sci.am/dlibra/publication/407140/edition/376268
376266,407138,376266,Հայաստանի Հանրապետության արդի գյուղացիությունը,Современное крестьянство Республики Армения (этнографическое исследование),"Գաբրիելյան, Մխիթար",ՀՀ ԳԱԱ Հնագիտության և ազգագրության ինստիտուտ ; «Ոստան» էթնոմշակութաբանական հետազոտությունների կենտրոն,Խմբ.՝ Դ. Ս. Վարդումյան,Երևան,2001,2001,Գիրք,Երևան,ՀՀ ԳԱԱ «Գիտություն» հրատ.,pdf,81 էջ,,,,5-8080-0485-3,AII/87183 ; AII/90561,hy,,Ազգագրություն Գյուղական համայնք Հայաստանի Հանրապետություն,https://arar.sci.am/dlibra/publication/407138/edition/376266
