id,publication_id,edition_id,title,other_title,author_creator,corporate_creators,contributors,description_abstract,date_period,year,type,place_of_publishing,publisher,format,extent,other_physical_description,volume,number,isbn,call_number,language,general_note,subject_keywords,url_original_object
374087,405240,374087,Մառը և հայագիտության հարցերը,Марр и вопросы арменоведения,,ՀՍՍՀ ԳԱ Հնագիտության և ազգագրության ինստիտուտ,Խմբ.՝ Բ. Ն. Առաքելյան ; Ս․ Տ․ Երեմյան ; Պ․ Մ․ Մուրադյան,Երևան,1968,1968,Գիրք,Երևան,ՀՍՍՀ ԳԱ հրատ.,pdf,305 էջ,դիմանկ. ; լուսանկ. ; 23 սմ,,,,AII/108354 ; Հովհ/2124 ; AII/42593 ; AII/42594 ; AII/42595,hy,,Հնագիտություն Հայագիտություն Հայագիտության երախտավորներ,https://arar.sci.am/dlibra/publication/405240/edition/374087
215376,235836,215376,Մարմնից դուրս գտնվող հոգին հայկական հրաշապատում հեքիաթներում,"Душа, находящаяся вне тела, в армянских волшебных сказках; The Soul Outside of the Body in Armenian Tales of Magic","Հայրապետյան, Թամար",ՀՀ ԳԱԱ Հնագիտության և ազգագրության ինստիտուտ,,"Հայկական հեքիաթներում թե՛ դիպաշարային և թե՛ մոտիվային մակարդակում բավական տարածված են մահվան և անդրշիրիմյան կեցության էզոթերիկ (գաղտնախորհուրդ) պատկերացումերը, որոնց համաձայն` կյանքը կամ հոգին ընկալվում է որպես որոշակի ծավալի կոնկրետ նյութեղեն առարկա, որը կարող է ժամանակավորապես բացակայել մարմից և հեռավորությունից շարունակել շնչավորել մարմինը: В армянских сказках наиболее распространены экзотерические представления о смерти и загробной жизни, согласно которым жизнь и душа человека воспринималась как нечто материальное, имеющее определенный объем, который может временно находиться вне тела и на расстоянии одушевлять оное. In Armenian folktales both on the level of the plot and motif, the esoteric notions death and underworld are very popular. According to these, the life or soul is perceived as a material object having certain volume, which can temporary leave the body and exist outside the body while still supporting it with life. According to ancient logic, in dangerous situations it is safer to keep the soul in objects (animals, plants, or other objects) than to carry it in the body.",2018,2018,Հոդված,,ՀՀ ԳԱԱ Հնագիտության և ազգագրության ինստիտուտ,pdf,,,2,,978-9939-9178-2-5,,,,Folklore բանահյուսություն հրաշապատում հեքիաթ առասպել հոգի հավատալիք,https://arar.sci.am/dlibra/publication/235836/edition/215376
379949,411154,379949,Մեծամոր,Мецамор։ (Исследование по данным раскопок 1965-1966 гг.),"Խանզադյան, Է. Վ. ; Մկրտչյան, Կ․ Հ․ ; Պարսամյան, Է. Ս․",Հայկական ՍՍՀ ԳԱ Հնագիտության և ազգագրության ինստիտուտ,Պատ․ խմբ․՝ Հ․ Ա․ Մարտիրոսյան,Երևան,1973,1973,Գիրք,Երևան,Հայկական ՍՍՀ ԳԱ հրատ.,pdf,214 էջ,"աղյս․, նկ․ ; 30 սմ",,,,AIII/4108 ; AIII/4109 ; AIII/4110 ; AIII/4111,hy,,Հնագիտություն Մեծամոր Պատմական հուշարձաններ,https://arar.sci.am/dlibra/publication/411154/edition/379949
379791,410976,379791,Մեծ եղեռն,Геноцид ; Genocide,"Սվազլյան, Վերժինե",ՀՀ ԳԱԱ Հնագիտության և ազգագրության ինստիտուտ,Խմբ.՝ Ս. Հարությունյան,Երևան,1995,1995,Գիրք,Երևան,ՀՀ ԳԱԱ «Գիտություն» հրատ.,pdf,223 էջ,"8 ներդ. թ. գուն. նկ., քարտեզ., 29 սմ",,,5<8080-0336-9,AIII/6603 ; AIII/6617 ; AIII/6618,hy,,"Հայոց ցեղասպանություն, 1915-1923 Սփյուռքահայ պատմություն Վկայություններ",https://arar.sci.am/dlibra/publication/410976/edition/379791
414856,449855,414856,"Մերձաւոր Արեւելքի հայ համայնքներ և ՀՀ յարաբերութիւններ. արդի միտումներ, մարտահրաւէրներ և հնարաւորութիւններ",,"Ճէպէճեան, Հրայր",ՀՀ ԳԱԱ Հնագիտության և ազգագրության ինստիտուտ,,"Քաղաքական եւ տնտեսական անորոշ եւ ճգնաժամային օրերը ու տակաւին պատերազմական ու ապահովական իրավիճակները իրենց ժխտական անդրադարձը ունեցան եւ կ’ունենան Մերձաւոր Արեւելքի հայ համայնքներու իրավիճակին վրայ։ Տեղի ունեցաւ ու տակաւին կ’ընթանայ գաղթ՝ դէպի արեւմտեան աշխարհ, Ամերիկայի Միացեալ Նահանգներ, Աւստրալիա, Եւրոպա ու այլ տեղեր։ 1991-ի ՀՀ անկախացումէն ետք՝ բաւական թիւով հայեր գաղթեցին ու կը գաղթեն մինչեւ օրս դէպի Հայաստան։ Այսուհանդերձ, հայ իրականութիւնը Մերձաւոր Արեւելքի մէջ ունի պատմական ամուր կռուան եւ ենթահող՝ կապուած հողին, մշակոյթին եւ ազգային ինքնութեան։ Այս գաղութները արմատացած են՝ անկախ իրենց ներկայ օրերու կարգավիճակներէն, եւ տակաւին կը գործեն ու իրենց մասնակցութիւնը կը բերեն ՀՀ հետ յարաբերութիւններու իմաստով, ինչ որ պիտի վեր առնենք այս ուսումասիրութեան մէջ։ Սոյն յօդուածը, ըստ երկրանուան այբբենական կարգի, նախ հակիրճ ձեւով կը ներկայացնէ վերոյիշեալ իւրաքանչիւր գաղութի ներկայ վիճակը, մանրամասնօրէն կ’անդրադառնայ զեկուցողներու հետ հարցազրոյցներուն պատասխաններուն, եւ անոնց հիման վրայ կը կատարէ վերլուծումեր եւ յանձնարարականներ։ Relations between the Armenian communities in the Near East and the Republic of Armenia (RA) are of utmost importance for both sides. To better understand and evaluate the nature of the current relations – trends, challenges, and opportunities, between the RA and the Armenian communities in Egypt, Jordan, Kuwait, Iraq, Lebanon, Syria, and the United Arab Emirates, the author conducted a research – 19 open-ended interviews with Armenians aged 35 to 67 who live in these diaspora communities. This paper presents the findings gathered from these interviews. The results demonstrate the emphasis these various communities put on maintaining healthy, vibrant cooperation with the homeland and its representatives. The data show that each diaspora community has its own local economic, political, and social challenges. The interviewees highlighted the significance of their relationship with the office of the Diaspora Commissioners. The data gleaned from the interviews underscore and enumerate the many opportunities – educational, economic, and political, that the RA can benefit from by establishing better and more productive relationships with the various countries selected for this study. The data lend ideas for future research, especially in the areas of exploring various avenues for strengthening Armenia-Diaspora relationships that would undoubtedly foster mutual understanding, partnership, joint action, combined effort, and mutual support. Отношения между армянскими общинами Ближнего Востока и Республикой Армения (РА) имеют огромное значение для обеих сторон. Чтобы лучше понять и оценить характер нынешних отношений – тенденции, вызовы и возможности – между РА и армянскими общинами Египта, Иордании, Кувейта, Ирака, Ливана, Сирии и Объединенных Арабских Эмиратов, автор провел исследование: 19 открытых интервью с 35–67-летними армянами, проживающими в вышеуказанных диаспоральных общинах. В данной статье представлены результаты, полученные в ходе этих интервью. Данные показывают, что у каждой общины есть свои местные экономические, политические и социальные проблемы. Опрошенные подчеркнули важность своих отношений с офисом Уполномоченных по делам диаспоры. Данные, полученные в ходе интервью, подчеркивают и перечисляют многочисленные возможности – образовательные, экономические и политические, – которые РА может получить, установив более эффективные и продуктивные отношения с различными странами, выбранными для данного исследования. Полученные данные дают идеи для будущих исследований, особенно в области изучения различных путей укрепления отношений Армения–Диаспора, которые, несомненно, способствовали бы взаимопониманию, партнерству, совместным действиям, объединению усилий и взаимной поддержке.",2025,2025,Հոդված,,ՀՀ ԳԱԱ Հնագիտության և ազգագրության ինստիտուտ,pdf,,,7,,2953-805X,,,,Սփիւռք Մերձաւոր Արևելք Միջին Արևելք ՀՀ դեսպանատուն հայ համայնքներ,https://arar.sci.am/dlibra/publication/449855/edition/414856
379794,410979,379794,Միգրացիա և առօրեականություն,,"Թադևոսյան, Աղասի",ՀՀ ԳԱԱ Հնագիտության և ազգագրության ինստիտուտ,,Երևան,2014,2014,Գիրք,Երևան,ՀՀ ԳԱԱ «Գիտություն» հրատ.,pdf,168 էջ,21 սմ,,,978-5-8080-1078-9,AII/110465 ; AII/99845,hy,,Միգրացիա Մշակութային ճանապարհորդություն,https://arar.sci.am/dlibra/publication/410979/edition/379794
379076,410259,379076,Միգրացիան և հայկական նոր սփյուռքը,Миграция и новая армянская диаспора ; Migration and armenian new diaspora,"Կարապետյան, Ռ. Ս.",ՀՀ Սփյուռքի նախարարություն ; ՀՀ ԳԱԱ Հնագիտության և ազգագրության ինստիտուտ,Պատ․ խմբ․՝ Ռ․ Ս․ Օհանջանյան,Երևան,2013,2013,Գիրք,Երևան,ՀՀ ԳԱԱ «Գիտություն» հրատ.,pdf,220 էջ,"նկ․, աղյս․",,,978-5-8080-1070-3,AII/99504 ; AII/99505 ; AII/99836,hy ; ru ; en,,Սփյուռք Միգրացիոն քաղաքականություն,https://arar.sci.am/dlibra/publication/410259/edition/379076
379848,411051,379848,Միջազգային գիտաժողով՝ նվիրված ակադեմիկոս Հովսեփ Օրբելու ծննդյան 125-ամյակին,"Международный симпозиум, посвященный 125-летию со дня рождения акад. Иосифа Абгаровича Орбели ; International conference on the ossasion of the 125-th anniversary of acad. Joseph Orbeli",,ՀՀ ԳԱԱ Հնագիտության և ազգագրության ինստիտուտ ; ՀՀ ԳԱԱ Արևելագիտության ինստիտուտ,,Երևան,2012,2012,Գիրք,Երևան,ՀՀ ԳԱԱ «Գիտություն» հրատ․,pdf,136 էջ,21 սմ,,,978-5-8080-0975-2,AII/98351,hy ; ru,,Հայագիտություն Պատմագիտություն Արևելագիտություն Միջազգային գիտաժողովի զեկուցումների դրույթներ,https://arar.sci.am/dlibra/publication/411051/edition/379848
379463,410550,379463,Միջին բրոնզ,Bronze moyen,"Դևեջյան, Սեդա",ՀՀ ԳԱԱ Հնագիտության և ազգագրության ինստիտուտ,Պատ․ խմբ․՝ Ա․ Ա․ Քալանթարյան,Երևան,2006,2006,Գիրք,Երևան,ՀՀ ԳԱԱ «Գիտություն» հրատ.,pdf,426 էջ,աղյս․,2,,5-8080-0655-4,AIII/9366 ; AIII/9367,hy,"Նվիրում եմ երիտասարդ, շնորհալի ճարտարապետ Հովհաննես Դեվեջյանի անմար հիշատակին",Հնագիտություն Լոռի Բերդ Պատմություն,https://arar.sci.am/dlibra/publication/410550/edition/379463
380884,412105,380884,Միջնադար,Средневековье,"Գրիգորյան, Գր. Ա.",ՀՍՍՀ ԳԱ Հնագիտության և ազգագրության ինստիտուտ,խմբ․՝ Ա․ Մ․ Նազինյան,Երևան,1981,1981,Գիրք,Երևան,ՀՍՍՀ ԳԱԱ հրատ.,pdf,372 էջ,22 սմ,Գիրք երկրորդ,,,AII/565541 ; AII/83295,hy,,Բանահյուսություն,https://arar.sci.am/dlibra/publication/412105/edition/380884
11075,12475,11075,Միջնադարյան Հայաստանի առևտրական կապերը VI-XIII դդ. (Ըստ ապակեգործության տվյալների),Торговие связи Средневековой Армении в VII-XIII вв. (По данным стеклоделия),"Ջանփոլադյան, Հ. Մ. ; Քալանթարյան, Ա. Ա.",ՀՍՍՀ ԳԱ հնագիտության և ազգագրության ինստիտուտ,Պատ. խմբ.՝ Բ. Ն. Առաքելյան,Երևան,1988,1988,Գիրք,Երևան,ՀՍՍՀ ԳԱ հրատ․,pdf,48 էջ,նկ․,VI,,,AIII/6166 ; AIII/6179 ; AIII/6180,ru ; hy ; en,14 (Հայաստանի հնագիտական հուշարձանները),Հնագիտություն Արհեստ Միջին դարեր Հայաստան Ապակեգործություն,https://arar.sci.am/dlibra/publication/12475/edition/11075
375396,406308,375396,Միջնադարյան Հայաստանի գեղարվեստական խեցեղենի զարդաձևերը,Орнаментальные мотивы художественной керамики средневековой Армении,"Բաբայան, Ֆրինա",ՀՍՍՀ ԳԱ Հնագիտության և ազգագրության ինստիտուտ,Պատ․ խմբ․՝ Ա. Ա. Քալանթարյան,Երևան,1981,1981,Գիրք,Երևան,ՀՍՍՀ ԳԱ հրատ.,pdf,118 էջ,,,,,AII/110818,hy,,Խեցեգործություն Զարդարվեստ,https://arar.sci.am/dlibra/publication/406308/edition/375396
11015,12394,11015,Միջնադարյան Հայաստանի գեղարվեստական մետաղը IX-XIII դդ. ; Միջնադարյան Հայաստանի հախճապակին IX-XIV դդ.,Художественный металл Средневековой Армении IX-XIII вв. ; Фаянс Средневековой Армении IX-XIV вв.,"Հակոբյան, Ն. Գ. ; Ժամկոչյան, Ա. Ս.",ՀՍՍՀ ԳԱ հնագիտության և ազգագրության ինստիտուտ,Պատ. խմբ.՝ Ա. Ա. Քալանթարյան,Երևան,1981,1981,Գիրք,Երևան,ՀՍՍՀ ԳԱ հրատ․,pdf,107 էջ,նկ․,III,,,AIII/5118 ; AIII/5117 ; AIII/5119,hy ; ru,10 (Հայաստանի հնագիտական հուշարձանները),Հնագիտություն Հայաստան Միջին դարեր,https://arar.sci.am/dlibra/publication/12394/edition/11015
375669,406478,375669,Միջնադարյան Հայաստանի զենքերի տեսակները,,"Աբրահամյան, Վ.",ՀՍՍՌ ԳԱ Պետական պատմական թանգարան,,Երևան,1950,1950,Գիրք,Երևան,ՀՍՍՌ ԳԱ հրատ.,pdf,38-98 էջ,21 սմ ; նկ․,,,,AII/110836,hy,"Առանձնատիպ Հայաստանի Պետական պատմական թանգարանի «Աշխատություններ» հատոր II-ից, 1949 թ․",Հնագիտություն Հայաստան,https://arar.sci.am/dlibra/publication/406478/edition/375669
376480,407430,376480,Միջնադարյան հայ ճարտարապետներ և քարագործ վարպետներ,Средневековые армянские архитекторы и мастера по камню,"Բարխուդարյան, Ս․",ՀՍՍՌ ԳԱ Հնագիտության և ազգագրության ինստիտուտ,Պատ․ խմբ․՝ Մ․ Դ․ Մազմանյան,Երևան,1963,1963,Գիրք,Երևան,ՀՍՍՌ ԳԱ հրատ.,pdf,380 էջ,նկ․,,,,AIII/2033 ; AIII/2034 ; AIII/2035 ; AIII/2036 ; AIII/2037,hy,,Հայ ճարտարապետության պատմություն,https://arar.sci.am/dlibra/publication/407430/edition/376480
255855,263643,255855,Միջնադարյան մշակութային լանդշաֆտը Վայոց ձորում՝ Մետաքսի ճանապարհի համակարգում,Medieval cultural landscape in Vayots Dzor within the context of the Silk Road; Средневековый культурный ландшафт в Вайоц Дзоре в контексте Шелкового пути,"Բաբաջանյան, Աստղիկ ; Ֆրանկլին, Քեթրին",ՀՀ ԳԱԱ Հնագիտության և ազգագրության ինստիտուտ,,"Վայոց ձորի մարզի միջնադարյան մշակութային լանդշաֆտը դիտարկելով Մետաքսի ճանապարհի երևույթով ձևավորված նյութական ու մշակութային փոխանակությունների համատեքստում՝ ցույց է տրվում, որ միջնադարում (հատկապես 13 –14-րդ դդ.)․ This paper discusses preliminary works of Vayots Dzor Silk Road Survey (VDSRS) project revisiting the medieval archaeological landscape in Vayots Dzor region, which was actively integrated into the material and cultural exchanges, formed by Silk Road phenomenon. В статье обсуждаются предварительные работы в рамках проекта Исследование Шелкового пути в Вайоц дзоре (VDSRS), при этом средневековый археологический ландшафт в Вайоцдзорской области рассматривается в кoнтексте процессов материального и культурного oбмена, обусловленного Шелковым путем.",2019,2019,Հոդված,,ՀՀ ԳԱԱ Հնագիտության և ազգագրության ինստիտուտ,pdf,,,3,,978-9939-9178-9-4,,,,Ազգագրություն Հնագիտություն Մետաքսի ճանապարհ Հայաստան Վայոց ձոր հնագիտական լանդշաֆտ,https://arar.sci.am/dlibra/publication/263643/edition/255855
215383,235843,215383,Միջնադարյան Սաղմոսավանքի սրբությունները,Святыни средневекового Сагмосаванка; Sacred Objects from Medieval Saghmosavank,"Մանուչարյան, Աշոտ",ՀՀ ԳԱԱ Հնագիտության և ազգագրության ինստիտուտ,,"Միջնադարում Սաղմոսավանքը հայտնի է եղել ոչ միայն վարդապետական բարձրագույն դպրոցով, հարուստ գրադարանով, այլև իր հարկերի ներքո պահվող քրիստոնեական սրբություններով: Դրանց թիվը եղել է ինը, որոնցից չորսը` խաչ, մեկը` խաչքար, երկուսը` սրբերի մասունքներ (ս.Հակոբ Մծբնացու Աջը, ս.Հակոբ Տյառնեղբոր Մատը) և երկու գերեզման, որոնք պատկանում են վանքի նշանավոր առաջնորդների: Այդ սրբությունների մի մասն այսօր էլ կա, թե՛ Մայր Աթոռ Ս.Էջմիածնում, թե՛ Սաղմոսավանքի տարածքում: В средние века Сагмосаванк был известен не только своей высшей духовной школой, богатой библиотекой, но и христианскими святынями, которые хранились под крышей этого монастыря. Их было девять, из которых – четыре креста, один хачкар, мощи двух святых (Длань св. епископа Акопа из Мцбины, Палец св. Акопа Брата Господня) и две могилы, которые принадлежали двум известным главам епархии монастыря. Часть этих святынь до сих пор существует, некоторые в Святом Престоле Эчмиадзина, а некоторые на территории монастыря. The medieval monastery Saghmosavank was not only known for its higher school and the rich library, but also for the Christian sacred objects preserved under its floors. They were nine in number, four of which were crosses, one was a khachkar (cross-stone), two were relics of saints (the right hand of St. Hakob Mtsbinatsi, the finger of St. Hakob Lord’s Brother). There were also two graves which belonged to two noted leaders of the monastery. Today a part of it is kept in the See of St. Etchmiadzin and another part is preserved on the territory of the Monastery.",2018,2018,Հոդված,,ՀՀ ԳԱԱ Հնագիտության և ազգագրության ինստիտուտ,pdf,,,2,,978-9939-9178-2-5,,,,"Ազգագրություն Հնագիտություն Սաղմոսավանք սրբություն, խաչ միջնադար դպրոց",https://arar.sci.am/dlibra/publication/235843/edition/215383
215388,235848,215388,Միջսեռային հաղորդակցության որոշ առանձնահատկություններ հետխորհրդային Հայաստանում,Некоторые аспекты гендерной коммуникации в постсоветской Армении; Some Aspects of Gender Communication Issues in Post-Soviet Armenia,"Մանուկյան, Լիլիթ",ՀՀ ԳԱԱ Հնագիտության և ազգագրության ինստիտուտ,,"Հոդվածում քննարկվում են ներկա հայաստանյան առօրյա կյանքում տղամարդ-կին հաղորդակցության ոլորտում առկա մի շարք խնդիրներ: Այդ խնդիրները ներկայացվում են երկու հարթությունում` տարածական և լեզվական: Մասնավորապես խոսվում է հաղորդակցության այնպիսի տարածքների, այդ տարածքներում գործածվող լեզվի և շրջանառվող թեմաների մասին, որոնք սովորույթի ուժով համարվում են տղամարդկային: Статья касаетcя некоторых аспектов межполовых коммуникационных проблем в повседневной жизни современного армянского общества. Обсуждениe проблемы представленo на двух уровнях: пространственном и языковом. В частности, речь идет о таких коммуникативных сферах и характерных для них языковых и тематических особенностях, которые традиционно считаются мужскими. The paper discusses some aspects of gender communication problems in daily life of the contemporary Armenian society. Gender communication problems are presented on two levels: spatial and linguistic. Particularly, the paper describes the communication spaces as well as the main topics and linguistic means applied in those places, which, according to tradition, are considered as male (masculine).",2018,2018,Հոդված,,ՀՀ ԳԱԱ Հնագիտության և ազգագրության ինստիտուտ,pdf,,,2,,978-9939-9178-2-5,,,,The family; Marriage; Woman Marriage միջսեռային հաղորդակցություն միջսեռային անհավասարություն կանացի լեզու տղամարդկային տարածք,https://arar.sci.am/dlibra/publication/235848/edition/215388
